file1,start1,end1,file2,start2,end2,classification,notes
11861598_0.java,1,18,eclipse_SDK/eclipse_SDK-4.3/src/src/org/eclipse/jface/wizard/WizardDialog.java,377,394,QS,SO copies code from eclipse to assist answer
16860613_0.java,118,165,eclipse_SDK/eclipse_SDK-4.3/src/src/org/eclipse/jface/viewers/StyledString.java,118,165,QS,"although SO question was deleted, the snippet is the exact same class as the eclipse class"
24330611_0.java,165,177,jung2-2_0_1/jung-samples-2.0.1/edu/uci/ics/jung/samples/PluggableRendererDemo.java,370,382,QS,SO question tags jung. SO snippet includes a class called JUNGTree.
21998949_0.java,10,89,jfreechart-1/jfreechart-1.0.13/source/org/jfree/chart/plot/SpiderWebPlot.java,502,578,QS,SO says he copied from jfreechart and altered a bit
6149818_0.java,1,20,spring-framework-3.0.5/spring-framework-3.0.5.RELEASE/projects/org.springframework.core/src/main/java/org/springframework/util/DefaultPropertiesPersister.java,67,86,QS,answer copies code from spring to explain behaviour
24330611_0.java,165,177,jung2-2_0_1/jung-samples-2.0.1/edu/uci/ics/jung/samples/ImageEdgeLabelDemo.java,59,71,QS,SO question tags jung. SO snippet includes a class called JUNGTree.
20996373_0.java,1,15,spring-framework-3.0.5/spring-framework-3.0.5.RELEASE/projects/org.springframework.web.servlet/src/test/java/org/springframework/mock/web/DelegatingServletInputStream.java,6,20,QS,SO posts code form spring to use as an example to show a solution
18647984_0.java,48,63,hadoop-1/hadoop-1.0.0/src/mapred/org/apache/hadoop/mapreduce/lib/input/SequenceFileRecordReader.java,36,50,QS,SO says he was based on haddop code to come up with solution
24330611_0.java,166,177,jung2-2_0_1/jung-samples-2.0.1/edu/uci/ics/jung/samples/DrawnIconVertexDemo.java,83,94,QS,SO question tags jung. SO snippet includes a class called JUNGTree.
12936580_0.java,150,187,jfreechart-1/jfreechart-1.0.13/source/org/jfree/chart/renderer/xy/AbstractXYItemRenderer.java,532,569,QS,author asks a question tagging jfreechart
24330611_0.java,165,177,jung2-2_0_1/jung-samples-2.0.1/edu/uci/ics/jung/samples/VertexLabelAsShapeDemo.java,75,87,QS,SO question tags jung. SO snippet includes a class called JUNGTree.
6025026_0.java,47,93,jung2-2_0_1/jung-samples-2.0.1/edu/uci/ics/jung/samples/ShortestPathDemo.java,42,82,QS,SO says he copied code from jung example to find solution
25056629_1.java,1,14,iText-src-5/src/core/com/itextpdf/text/pdf/PdfWriter.java,538,551,QS,question is about iText. Author of answer posts the code from iText that is an example of the shortcome pointed by the question
13524878_0.java,1,16,netbeans-6.9.1-201007282301/java.source/test/unit/data/jdk/JTable.java,1469,1484,QS,SO provides code to point to the problem the author of the question had.
15131432_0.java,23,42,struts2-2.2.1-all/struts-2.2.1/src/core/src/main/java/org/apache/struts2/views/freemarker/FreemarkerManager.java,163,177,QS,SO is based on FreemarkerManager.java
22692838_1.java,1,16,lucene-4.3.0/lucene-4.3.0/queryparser/src/java/org/apache/lucene/queryparser/classic/QueryParserBase.java,668,680,QS,SO says he based on lucene code to reach solution (from Apache Solr's ClientUtils.escapeQueryChars()).
14940863_0.java,1,26,jstock-1.0.7c/jstock/src/org/yccheok/jstock/alert/GoogleMail.java,18,43,QS,SO says he copied from jstock
22230019_0.java,1,19,eclipse_SDK/eclipse_SDK-4.3/src/src/org/eclipse/swt/widgets/Widget.java,424,442,QS,SO copies code from Eclipse to help in the answer
3629882_0.java,1,26,jstock-1.0.7c/jstock/src/org/yccheok/jstock/gui/Utils.java,1484,1502,QS,"author of question copies from jstock, answer edits code to find solution"
4781746_0.java,1,13,spring-framework-3.0.5/spring-framework-3.0.5.RELEASE/projects/org.springframework.web.servlet/src/main/java/org/springframework/web/servlet/DispatcherServlet.java,91,103,QS,SO posts code from spring example to assist in reply
18687201_0.java,1,10,eclipse_SDK/eclipse_SDK-4.3/src/src/javax/servlet/http/HttpServlet.java,32,41,QS,original implementation of java servelet doPost. Eclipse copied this code to its code base and cloned over several other methods
24330611_0.java,162,177,jung2-2_0_1/jung-samples-2.0.1/edu/uci/ics/jung/samples/L2RTreeLayoutDemo.java,102,117,QS,SO question tags jung. SO snippet includes a class called JUNGTree.
19298607_0.java,1,10,hibernate-release-4/hibernate-release-4.2.2.Final/project/hibernate-core/src/main/java/org/hibernate/dialect/Oracle9iDialect.java,23,32,QS,author of questions asks a question for hibernate regarding a certyain extension. Author of answer says he'll need to add some methods to his class
23586872_1.java,1,20,junit-4/org/junit/Assert.java,33,52,QS,SO copies code from JUnit to assist reply.
698283_1.java,47,67,jstock-1.0.7c/jstock/src/org/yccheok/jstock/gui/POIUtils.java,55,75,SQ,"the author of qualitas code is the same person to ask the question in SO. the code provided in SO is the same as in qualitas. SO answer was in 30/03/09, qualitas code was originally comitted to jstock github at 31/03/09."
18687201_0.java,1,10,eclipse_SDK/eclipse_SDK-4.3/src/src/javax/servlet/http/HttpServlet.java,51,60,EX,original implementation of java servelet doPost. Eclipse copied this code to its code base and cloned over several other methods
6356081_0.java,1,10,iText-src-5/src/core/com/itextpdf/text/pdf/RandomAccessFileOrArray.java,353,362,EX,ONE-SIDED: SO answer code is copied from java.io.DataInputStream.readInt().
7071060_1.java,30,47,eclipse_SDK/eclipse_SDK-4.3/src/src/org/apache/http/entity/FileEntity.java,26,41,EX,author of answer provides code which is claimed to be based on apache code
8199584_0.java,68,91,netbeans-6.9.1-201007282301/lib.profiler.ui/src/org/netbeans/lib/profiler/ui/components/EqualFlowLayout.java,69,90,EX,SO solution is based on the original FlowLayout implementation. qualitas code also claims to be an extension of the original FlowLayout
10289462_0.java,4,23,eclipse_SDK/eclipse_SDK-4.3/src/src/org/apache/jasper/runtime/JspRuntimeLibrary.java,260,279,EX,SO code is from tomcat. Eclipse copied class from tomcat to Eclipse
19856538_0.java,22,31,netbeans-6.9.1-201007282301/properties/src/org/netbeans/modules/properties/UtilConvert.java,59,68,EX,author of answer says he copied from a java API class. Netbean's code is too old to be copied from stackoverflow and too similar to the java API class to be similar for chance 
14673198_1.java,3,13,struts2-2.2.1-all/struts-2.2.1/src/xwork-core/src/main/java/com/opensymphony/xwork2/util/classloader/JarResourceStore.java,33,43,EX,ONE-SIDED SO copied from IOUtils. code in struts is too similar not to be a clone
16207578_0.java,1,10,eclipse_SDK/eclipse_SDK-4.3/src/src/javax/servlet/http/HttpServlet.java,32,41,EX,SO posts code from HttpServlet to assist in reply. eclipse copied this class to its code base
6236324_0.java,114,123,aoisrc281/ArtOfIllusion/src/artofillusion/image/MovieEncoder.java,122,131,EX,stackoverflow code seems to come from a official sun code
24901004_0.java,1,17,netbeans-6.9.1-201007282301/cnd.repository/src/org/netbeans/modules/cnd/repository/util/LongHashMap.java,169,185,EX,ONE-SIDED SO posts code from original HashMap class. 
18105169_0.java,1,14,eclipse_SDK/eclipse_SDK-4.3/src/src/org/eclipse/equinox/internal/p2/core/helpers/CollectionUtils.java,18,32,EX,original implementation of indexOf method in the ArrayList class
15185345_0.java,21,33,Compiere_330_Source/release_330/ad/src/org/compiere/util/CachedRowSetImpl.java,512,525,EX,SO answer says the code is copied from http://tech.groups.yahoo.com/group/Firebird-Java/message/10715 which extends CachedRowSetImpl with lots of overriding methods.
14673198_1.java,3,13,apache-tomcat-7.0.2/apache-tomcat-7.0.2-src/java/org/apache/tomcat/util/http/fileupload/IOUtils.java,25,35,EX,SO copies from IOUtils. IOUtils is originally from apache.common.io. tomcat copied this code to its code base
14757346_0.java,1,14,struts2-2.2.1-all/struts-2.2.1/src/xwork-core/src/main/java/com/opensymphony/xwork2/inject/ContainerImpl.java,441,453,EX,OUTDATED: SO answer says the code is from Guice's source code and the code is already OUTDATED! (see https://github.com/google/guice/commit/135aa0e516219c6e63df634aa72377d13eec4970)
19856538_0.java,21,52,pooka_080505/net/suberic/util/FileVariableBundle.java,157,188,EX,both SO and qualitas copies code from original Java class implementation. ripped directly from java.util.Properties; hope they don't mind.
21996565_0.java,9,19,netbeans-6.9.1-201007282301/versioning.system.cvss/src/org/netbeans/modules/versioning/system/cvss/ui/wizards/CvsRootPanel.java,26,37,EX,ONE-SIDED: SO answer says the code is from http://docs.oracle.com/javase/7/docs/api/javax/swing/JTextField.html.
18161554_0.java,1,16,eclipse_SDK/eclipse_SDK-4.3/src/src/org/eclipse/help/internal/base/remote/HttpsUtility.java,81,100,EX,INSECURE CODE/ONE-SIDED: SO answer has a link of the original code: http://web.archive.org/web/20121022013056/http://exampledepot.com/egs/javax.net.ssl/TrustAll.html
19856538_0.java,21,50,eclipse_SDK/eclipse_SDK-4.3/src/src/org/eclipse/pde/internal/core/util/PropertiesUtil.java,64,93,EX,ONE-SIDED SO copies code from original Java class implementation. Eclipse says it's copied from another class in Eclipse.
554324_0.java,1,10,apache-tomcat-7.0.2/apache-tomcat-7.0.2-src/java/org/apache/tomcat/util/http/fileupload/IOUtils.java,25,35,EX,original snippet is from IOUtils. tomcat copied ioutils to its code base
8199584_0.java,68,91,netbeans-6.9.1-201007282301/mercurial/src/org/netbeans/modules/mercurial/ui/diff/VerticalFlowLayout.java,34,51,EX,SO solution is based on the original FlowLayout implementation. qualitas code also claims to be an extension of the original FlowLayout
8199584_0.java,44,67,netbeans-6.9.1-201007282301/lib.profiler.ui/src/org/netbeans/lib/profiler/ui/components/EqualFlowLayout.java,48,68,EX,SO solution is based on the original FlowLayout implementation. qualitas code also claims to be an extension of the original FlowLayout
12844115_0.java,139,149,apache-log4j-1.2.16/apache-log4j-1.2.16/src/main/java/org/apache/log4j/lf5/viewer/categoryexplorer/CategoryAbstractCellEditor.java,83,93,UD,cloned code. no evidence from where
10565927_0.java,1,18,hibernate-release-4/hibernate-release-4.2.2.Final/project/hibernate-core/src/main/java/org/hibernate/internal/util/ConfigHelper.java,64,82,UD,cloned code. no evidence on source
12844115_0.java,128,138,apache-log4j-1.2.16/apache-log4j-1.2.16/src/main/java/org/apache/log4j/lf5/viewer/categoryexplorer/CategoryAbstractCellEditor.java,72,82,UD,cloned code. no evidence from where
12844115_0.java,139,149,apache-log4j-1.2.16/apache-log4j-1.2.16/src/main/java/org/apache/log4j/lf5/viewer/categoryexplorer/CategoryAbstractCellEditor.java,72,82,UD,cloned code. no evidence from where
12844115_0.java,128,138,freemind-src-0/freemind/freemind/modes/attributes/AttributeRegistry.java,120,130,UD,cloned code. no evidence from where
12844115_0.java,128,138,apache-log4j-1.2.16/apache-log4j-1.2.16/src/main/java/org/apache/log4j/lf5/viewer/categoryexplorer/CategoryAbstractCellEditor.java,83,93,UD,cloned code. no evidence from where
24680923_0.java,17,41,jstock-1.0.7c/jstock/src/org/yccheok/jstock/alert/GoogleMail.java,18,42,UD,clear clone
11202699_0.java,1,12,hsqldb-2/hsqldb-2.0.0/hsqldb/src/org/hsqldb/test/HsqldbTestCase.java,11,22,UD,common snippet for recursevely delete dirs
11092289_1.java,26,42,iReport-3/iReport-3.7.5-src/jasperserver-plugin/src/com/jaspersoft/ireport/jasperserver/ws/IReportSSLSocketFactory.java,49,71,UD,"cloned code. not evidence from where. code in qualitas older than stackoverflow answer, but code on SO snippet seems to be from a different system"
12428601_0.java,1,12,c-jdbc-2/c-jdbc-2.0.2-src/src/org/objectweb/cjdbc/common/util/FileManagement.java,4,15,UD,common snippet for recursevely delete dirs
11202699_0.java,1,12,db-derby-10/db-derby-10.6.1.0-src/java/testing/org/apache/derbyTesting/functionTests/tests/junitTests/compatibility/CompatibilityCombinations.java,813,824,UD,common snippet for recursevely delete dirs
12008316_0.java,11,31,myfaces-core-2.0.2/myfaces-core-2.0.2-src/src/myfaces-impl-2.0.2/org/apache/myfaces/util/AbstractAttributeMap.java,244,263,BP,similar equals() methods
13311280_0.java,76,86,netbeans-6.9.1-201007282301/form/test/qa-functional/data/SampleDesktopApplication/src/sampledesktopapplication/SampleDesktopView.java,80,90,BP,auto generated code for java swing
25044969_0.java,31,51,geotools-2/geotools-2.7-M3/modules/unsupported/coverage-experiment/coverage-api/src/main/java/org/geotools/coverage/io/impl/range/EnumMeasure.java,38,57,BP,similar equals() methods
13066157_0.java,14,41,geotools-2/geotools-2.7-M3/modules/unsupported/geometry/src/main/java/org/geotools/geometry/iso/primitive/CurveBoundaryImpl.java,62,88,BP,similar equals() methods
13389700_2.java,48,61,hibernate-release-4/hibernate-release-4.2.2.Final/project/hibernate-core/src/test/java/org/hibernate/test/annotations/entity/Country.java,12,24,BP,similar equals() methods
15850476_0.java,13,40,hibernate-release-4/hibernate-release-4.2.2.Final/project/hibernate-core/src/test/java/org/hibernate/test/unionsubclass/alias/PersonID.java,18,44,BP,similar equals() methods
4207100_3.java,26,46,eclipse_SDK/eclipse_SDK-4.3/src/src/org/eclipse/ui/texteditor/rulers/RulerColumnDescriptor.java,150,169,BP,similar equals() methods
3757982_0.java,1,22,eclipse_SDK/eclipse_SDK-4.3/src/src/org/eclipse/e4/core/internal/contexts/ContextChangeEvent.java,46,68,BP,similar equals() methods
9684751_0.java,10,37,hibernate-release-4/hibernate-release-4.2.2.Final/project/hibernate-core/src/test/java/org/hibernate/test/unionsubclass/alias/PersonID.java,18,44,BP,similar equals() methods
16688737_0.java,20,40,nakedobjects-4.0.0/nakedobjects-4.0.0/core/runtime/src/main/java/org/nakedobjects/runtime/persistence/query/PersistenceQueryAbstract.java,32,51,BP,similar equals() methods
4207100_3.java,26,46,eclipse_SDK/eclipse_SDK-4.3/src/src/org/eclipse/ui/internal/quickaccess/WizardElement.java,41,60,BP,similar equals() methods
15850476_0.java,13,40,hibernate-release-4/hibernate-release-4.2.2.Final/project/hibernate-core/src/test/java/org/hibernate/test/manytomanyassociationclass/compositeid/MembershipWithCompositeId.java,28,54,BP,similar equals() methods
1204658_0.java,108,124,netbeans-6.9.1-201007282301/o.jruby/patched_files/org/jruby/nb/lexer/yacc/StringTerm.java,402,417,BP,similar equals() methods
13435398_0.java,94,114,rssowl-2.0.5/org.rssowl.ui/src/org/rssowl/ui/internal/dialogs/properties/EntityPropertyPageWrapper.java,82,101,BP,similar equals() methods
17997605_0.java,6,22,hibernate-release-4/hibernate-release-4.2.2.Final/project/hibernate-envers/src/test/java/org/hibernate/envers/test/various/Person.java,19,35,BP,accidentally similar getter
17941176_0.java,72,99,eclipse_SDK/eclipse_SDK-4.3/src/src/org/eclipse/core/internal/databinding/Pair.java,16,42,BP,similar equals() methods
20203510_1.java,1,20,lucene-4.3.0/lucene-4.3.0/core/src/java/org/apache/lucene/store/FlushInfo.java,19,37,BP,similar equals() methods
3910602_0.java,1,10,lucene-4.3.0/lucene-4.3.0/core/src/java/org/apache/lucene/util/automaton/SortedIntSet.java,210,220,BP,Similar boiler-plate implementation of toString().
10396359_0.java,21,33,apache-roller-4.0.1/apache-roller-src-4.0.1/tomcat/work/Catalina/localhost/roller/org/apache/jsp/WEB_002dINF/jsps/editor/Templates_jsp.java,139,151,BP,auto generated code from jsp by tomcat
13435398_0.java,94,114,eclipse_SDK/eclipse_SDK-4.3/src/src/org/eclipse/ui/internal/views/markers/MarkersViewColumnsDialog.java,163,182,BP,similar equals() methods
12776901_0.java,1,17,hibernate-release-4/hibernate-release-4.2.2.Final/project/hibernate-core/src/test/java/org/hibernate/test/annotations/derivedidentities/bidirectional/Order.java,45,61,BP,accidentally similar hashCode() and equals()
13435398_0.java,94,114,eclipse_SDK/eclipse_SDK-4.3/src/src/org/eclipse/jdt/core/refactoring/descriptors/ExtractClassDescriptor.java,52,71,BP,similar equals() methods
12008316_0.java,11,31,hibernate-release-4/hibernate-release-4.2.2.Final/project/hibernate-core/src/test/java/org/hibernate/test/pagination/Entry.java,39,58,BP,similar equals() methods
25386510_0.java,1,17,spring-framework-3.0.5/spring-framework-3.0.5.RELEASE/projects/org.springframework.context/src/test/java/org/springframework/context/annotation/AnnotationConfigApplicationContextTests.java,193,209,BP,accidentally similar hashCode() and equals()
23197177_1.java,13,29,eclipse_SDK/eclipse_SDK-4.3/src/src/org/eclipse/jdt/internal/ui/text/spelling/engine/AbstractSpellDictionary.java,55,70,BP,similar equals() methods
18614607_0.java,29,39,jasperreports-3/jasperreports-3.7.4/src/net/sf/jasperreports/j2ee/servlets/XmlServlet.java,100,109,BP,common way of implementing a servlet try catch block
3910602_0.java,1,10,spring-framework-3.0.5/spring-framework-3.0.5.RELEASE/projects/org.springframework.core/src/main/java/org/springframework/core/ControlFlowFactory.java,46,55,BP,Similar boiler-plate implementation of toString().
1516601_0.java,19,46,hibernate-release-4/hibernate-release-4.2.2.Final/project/hibernate-envers/src/test/java/org/hibernate/envers/test/integration/accesstype/Country.java,38,64,BP,similar equals() methods
10194435_0.java,33,60,hibernate-release-4/hibernate-release-4.2.2.Final/project/hibernate-core/src/test/java/org/hibernate/test/manytomanyassociationclass/compositeid/MembershipWithCompositeId.java,28,54,BP,similar equals() methods
16688737_0.java,20,40,hibernate-release-4/hibernate-release-4.2.2.Final/project/hibernate-core/src/test/java/org/hibernate/test/annotations/cascade/circle/identity/AbstractEntity.java,42,61,BP,similar equals() methods
5764008_1.java,140,159,eclipse_SDK/eclipse_SDK-4.3/src/src/org/eclipse/ui/internal/quickaccess/PropertiesElement.java,46,65,BP,similar equals() methods
16688737_0.java,20,40,netbeans-6.9.1-201007282301/groovy.editor/src/org/netbeans/modules/groovy/editor/api/completion/CompletionHandler.java,1808,1823,BP,similar equals() methods
5961624_0.java,13,33,eclipse_SDK/eclipse_SDK-4.3/src/src/org/apache/lucene/search/WildcardQuery.java,52,71,BP,similar equals() methods
10055548_0.java,52,79,eclipse_SDK/eclipse_SDK-4.3/src/src/org/apache/lucene/search/payloads/PayloadNearQuery.java,76,102,BP,similar equals() methods
14155715_0.java,1,17,lucene-4.3.0/lucene-4.3.0/core/src/java/org/apache/lucene/search/TopTermsRewrite.java,115,130,BP,similar equals() methods
3987965_0.java,1,13,netbeans-6.9.1-201007282301/java.source/test/qa-functional/src/org/netbeans/test/java/Utilities.java,103,115,BP,Boiler-plate code to delete a directory.
4498118_0.java,38,58,netbeans-6.9.1-201007282301/mobility.midpexamples/VDCustomComponents/src/smscomposerexample/SMSComposerExample.java,117,137,BP,accidentally similar getter
13435398_0.java,94,114,nakedobjects-4.0.0/nakedobjects-4.0.0/core/runtime/src/main/java/org/nakedobjects/runtime/persistence/query/PersistenceQueryAbstract.java,32,51,BP,similar equals() methods
10748516_0.java,1,17,eclipse_SDK/eclipse_SDK-4.3/src/src/org/eclipse/core/internal/databinding/BindingStatus.java,41,56,BP,similar equals() methods
9591522_0.java,18,45,hibernate-release-4/hibernate-release-4.2.2.Final/project/hibernate-envers/src/test/java/org/hibernate/envers/test/integration/accesstype/Country.java,38,64,BP,similar equals() methods
5961624_0.java,13,33,geotools-2/geotools-2.7-M3/modules/library/main/src/main/java/org/geotools/styling/PointSymbolizerImpl.java,57,76,BP,similar equals() methods
10055548_0.java,52,79,eclipse_SDK/eclipse_SDK-4.3/src/src/org/eclipse/core/internal/resources/BuildConfiguration.java,25,51,BP,similar equals() methods
14636363_1.java,64,80,apache-roller-4.0.1/apache-roller-src-4.0.1/apps/weblogger/src/java/org/apache/roller/weblogger/business/themes/SharedThemeTemplate.java,38,54,BP,similar getters & setters methods
4207100_3.java,26,46,eclipse_SDK/eclipse_SDK-4.3/src/src/org/eclipse/equinox/internal/p2/metadata/TouchpointData.java,13,32,BP,similar equals() methods
13311280_0.java,214,225,netbeans-6.9.1-201007282301/swingapp/appshells/BasicShellApp/src/applicationpackage/ShellView.java,80,91,BP,auto generated code for java swing
13435398_0.java,94,114,lucene-4.3.0/lucene-4.3.0/core/src/java/org/apache/lucene/search/spans/SpanTermQuery.java,50,69,BP,similar equals() methods
5961624_0.java,13,33,eclipse_SDK/eclipse_SDK-4.3/src/src/org/eclipse/e4/core/internal/di/ClassRequestor.java,52,71,BP,similar equals() methods
23415361_1.java,10,23,eclipse_SDK/eclipse_SDK-4.3/src/src/org/eclipse/jdt/internal/corext/dom/fragments/SimpleFragment.java,51,63,BP,similar equals() methods
10055548_0.java,52,79,eclipse_SDK/eclipse_SDK-4.3/src/src/org/eclipse/jdt/internal/core/SourceMapper.java,85,111,BP,similar equals() methods
24330611_0.java,74,86,hibernate-release-4/hibernate-release-4.2.2.Final/project/hibernate-envers/src/test/java/org/hibernate/envers/test/integration/accesstype/Country.java,34,46,BP,accidentally similar hashCode() and equals()
5764008_1.java,140,159,eclipse_SDK/eclipse_SDK-4.3/src/src/org/eclipse/ui/internal/views/markers/MarkersViewColumnsDialog.java,163,182,BP,similar equals() methods
6931385_0.java,9,22,netbeans-6.9.1-201007282301/cnd.api.remote/src/org/netbeans/modules/cnd/api/remote/RemoteFile.java,123,135,BP,similar equals() methods
12008316_0.java,11,31,wct-package-v1.5.2/WCTCore/src-app/org/webcurator/domain/model/auth/User.java,181,200,BP,similar equals() methods
22124868_0.java,1,28,hibernate-release-4/hibernate-release-4.2.2.Final/project/hibernate-entitymanager/src/test/java/org/hibernate/ejb/test/metagen/mappedsuperclass/idclass/ProductAttributeId.java,19,45,BP,similar equals() methods
3987965_0.java,1,13,netbeans-6.9.1-201007282301/junit/test/qa-functional/src/org/netbeans/test/junit/utils/Utilities.java,61,73,BP,Boiler-plate code to delete a directory.
22124868_0.java,1,28,lucene-4.3.0/lucene-4.3.0/core/src/java/org/apache/lucene/index/Term.java,41,67,BP,similar equals() methods
10308733_1.java,1,20,hibernate-release-4/hibernate-release-4.2.2.Final/project/hibernate-core/src/test/java/org/hibernate/test/querycache/CompositeKey.java,24,42,BP,similar equals() methods
7452490_1.java,1,34,hibernate-release-4/hibernate-release-4.2.2.Final/project/hibernate-core/src/test/java/org/hibernate/test/annotations/derivedidentities/bidirectional/OrderLine.java,60,93,BP,similar equals() methods
10396359_0.java,21,33,apache-roller-4.0.1/apache-roller-src-4.0.1/tomcat/work/Catalina/localhost/roller/org/apache/jsp/WEB_002dINF/jsps/tiles/footer_jsp.java,96,108,BP,auto generated code by JSP
13435398_0.java,94,114,hibernate-release-4/hibernate-release-4.2.2.Final/project/hibernate-core/src/test/java/org/hibernate/test/propertyref/DoesNotWork.java,61,80,BP,similar equals() methods
5764008_1.java,140,159,geotools-2/geotools-2.7-M3/modules/unsupported/geometry/src/main/java/org/geotools/geometry/iso/primitive/RingImplUnsafe.java,97,116,BP,similar equals() methods
3357300_0.java,7,20,eclipse_SDK/eclipse_SDK-4.3/src/src/org/apache/lucene/search/spans/SpanMultiTermQueryWrapper.java,156,168,BP,similar equals() methods
25044969_0.java,31,51,hibernate-release-4/hibernate-release-4.2.2.Final/project/hibernate-core/src/test/java/org/hibernate/test/annotations/cascade/multicircle/jpa/sequence/AbstractEntity.java,42,61,BP,similar equals() methods
13824658_2.java,79,88,netbeans-6.9.1-201007282301/java.source/src/org/netbeans/modules/java/ui/FmtImports.java,63,73,BP,common snippet to initialize a table in java swing
22448174_0.java,1,13,eclipse_SDK/eclipse_SDK-4.3/src/src/org/apache/lucene/search/spans/SpanMultiTermQueryWrapper.java,156,168,BP,similar equals() methods
21581988_0.java,124,140,eclipse_SDK/eclipse_SDK-4.3/src/src/org/eclipse/core/internal/resources/FilterDescription.java,61,76,BP,similar equals() methods
14636363_1.java,64,80,jag-6/jag-6.1/src/com/finalist/jaggenerator/template/TemplateConfigParameter.java,21,37,BP,similar getters & setters methods
23197177_1.java,13,29,geotools-2/geotools-2.7-M3/modules/library/main/src/main/java/org/geotools/filter/capability/FunctionNameImpl.java,43,58,BP,similar equals() methods
25044969_0.java,31,51,wct-package-v1.5.2/WCTCore/src-app/org/webcurator/domain/model/dto/UserDTO.java,130,149,BP,similar equals() methods
19220757_0.java,1,17,geotools-2/geotools-2.7-M3/modules/library/main/src/main/java/org/geotools/filter/capability/FunctionNameImpl.java,43,58,BP,similar equals() methods
13435398_0.java,94,114,eclipse_SDK/eclipse_SDK-4.3/src/src/org/eclipse/ui/trace/internal/datamodel/TracingComponent.java,26,45,BP,similar equals() methods
5961624_0.java,13,33,eclipse_SDK/eclipse_SDK-4.3/src/src/org/apache/lucene/search/spans/SpanTermQuery.java,42,61,BP,similar equals() methods
2265637_0.java,22,42,geotools-2/geotools-2.7-M3/modules/library/jdbc/src/main/java/org/geotools/jdbc/RegexpValidator.java,29,48,BP,similar equals() methods
4207100_3.java,26,46,hibernate-release-4/hibernate-release-4.2.2.Final/project/hibernate-core/src/test/java/org/hibernate/test/annotations/cascade/circle/sequence/AbstractEntity.java,42,61,BP,similar equals() methods
13721279_0.java,4,13,hibernate-release-4/hibernate-release-4.2.2.Final/project/hibernate-core/src/test/java/org/hibernate/metamodel/source/annotations/xml/Father.java,3,15,BP,"similar variable names, getters and setters"
17839323_0.java,9,25,jedit4/jEdit/org/gjt/sp/jedit/options/BrowserColorsOptionPane.java,237,258,BP,"The chunk of code in if-else seems like a boiler-plate code. It can be found in several implementation of getTableCellRendererComponent over the web, e.g. http://www.java2s.com/Code/Java/Swing-Components/ButtonTableExample.htm."
4207100_3.java,26,46,eclipse_SDK/eclipse_SDK-4.3/src/src/org/eclipse/e4/core/internal/di/ClassRequestor.java,52,71,BP,similar equals() methods
25044969_0.java,31,51,hibernate-release-4/hibernate-release-4.2.2.Final/project/hibernate-core/src/test/java/org/hibernate/test/propertyref/DoesNotWork.java,61,80,BP,similar equals() methods
